organization,organization_url,project_summary,year_approved,status,amount,duration
Eastern Market Corporation,www.easternmarket.com ,"To support Eastern Market Corporation in deepening its impact as a food hub in the Midwest by providing economic development services to the Detroit community. A portion of this grant will be redistributed to support capacity building for Eastern Market Corporation’s community partner, Food Lab Detroit.",2016,Closed,"$350,000",24 months
Energy Programs Consortium,www.energyprograms.org,General operating support.,2016,Closed,"$100,000",12 months
Jobs to Move America,www.jobstomoveamerica.org,"To support the expansion of the Jobs to Move America policy into new regions, strengthen it where it has been used, support building the federal infrastructure that supports the policy, and grow the Los Angeles Alliance for a New Economy’s national communications program.",2016,Closed,"$750,000",36 months
Make the Road New York,www.maketheroadny.org/,To support Make the Road New York’s efforts to organize and educate the mainland Puerto Rican Diaspora on the local impacts of the Island’s economic crisis.,2016,Closed,"$50,000",12 months
Marwen Foundation,http://www.marwen.org,"To support Marwen Lab, a year-long program offering thirty students intensive training in each participant’s chosen discipline, regular studio critiques, artist statement workshops, and college counseling.",2016,Active,"$200,000",36 months
Ms. Foundation for Women,www.forwomen.org ,"To support Ms. Foundation for Women to connect a national Women’s Economic Agenda (WEA), as well as support formation of WEAs in three states across the South; increase access to quality jobs and entrepreneurship opportunities for women; explore gender equity-based impact investing in advancing women’s economic justice and security.",2016,Closed,"$200,000",24 months
Museum for Contemporary Arts - The Contemporary,www.contemporary.org,"To support The Contemporary’s efforts to organize an Artist Retreat for practitioners in the Baltimore area. The four-day convening will focus on three main areas: professional development, networking, and community building.",2016,Closed,"$25,000",12 months
National Black Worker Center Project,www.Nationalblackworkercenters.org,To support the National Black Worker Center Project to implement a national campaign to change the narrative concerning the causes and solutions of the Black job crisis and the expansion of the network from 3 to 10 affiliates by the end of 2017.,2016,Closed,"$190,000",24 months
Pangea World Theater,http://www.pangeaworldtheater.org,"To support three of Pangea World Theater’s signature programs: 1) the National Institute of Directing and Ensemble Creation; 2) Race, North and South on the Mississippi; and 3) Lake Street Arts!",2016,Closed,"$225,000",36 months
Partnership for Southern Equity,psequity.org ,To support Partnership for Southern Equity provide capacity building to local and regional government agencies to develop and apply an equity analysis to investment decisions.,2016,Closed,"$100,000",24 months
Pittsburgh United,http://www.cleanriverscampaign.org,"To support green infrastructure education, advocacy and engagement efforts to maximize environmental, social and economic benefits, especially for underrepresented communities.",2016,Closed,"$250,000",24 months
Rising Tide Capital,http://www.RisingTideCapital.org,General operating support.,2016,Closed,"$45,000",12 months
Rockefeller Philanthropy Advisors,www.rockpa.org,"To support the planning and development of USArtPartners, a new national collaboration between artists and other partners interested in social change. USArtPartners will make introductions, nurture connections, align systems, and curate a focused portfolio of five projects.",2016,Closed,"$100,000",12 months
Southwest Folklife Alliance,www.southwestfolklife.org and http://www.tucsonmeetyourself.org,General operating support.,2016,Closed,"$150,000",36 months
STAR Communities,http://www.starcommunities.org/,To support STAR Communities’ efforts to strategically increase U.S. cities participation in and application of the rating system; and develop new standards and tools to improve access to data collection.,2016,Closed,"$175,000",18 months
Thunder Valley Community Development Corporation,http://www.ThunderValley.org,"To support the planning and design of the second phase of Regenerative Community Development. Community input, with a particular focus on the engagement of local artists, will inform the how the spaces are designed and programmed.",2016,Closed,"$300,000",36 months
Transportation Choices Coalition,http://www.transportationchoices.org,To support a statewide coalition in Washington to integrate equity and project performance metrics into transportation infrastructure decisions.,2016,Active,"$525,000",36 months
University of Detroit Mercy Detroit Collaborative Design Center,http://www.udmercy.edu,To support community collaborations and participatory community design for the Detroit Collaborative Design Center with urban neighborhoods and communities that are often ignored or excluded from the decision-making process.,2016,Closed,"$225,000",36 months
Winrock International,http://Winrock.org; Wallacecenter.org; NGFN.org ,"To support the Wallace Center’s expansion of the National Good Food Network and build a regional food economies working group, fellows program and strategic communications that expands the national dialogue to emphasize economic impact.",2016,Closed,"$375,000",24 months
Wisconsin Jobs Now Organizing Foundation,www.wisconsinjobsnow.org ,To support the Wisconsin Jobs Now Organizing Foundation (WJN) in exploring future investment opportunities for the Surdna Foundation in Milwaukee and to support WJN’s executive leadership and direction.,2016,Closed,"$10,000",12 months
Young Chicago Authors,http://www.youngchicagoauthors.org,"To provide closeout support for Public Workshops and the Crossing the Street youth poetry symposium. This grant closes out our previous strategies in preparation for the rollout of our new arts and culture program, Radical Imagination for Racial Justice.",2016,Active,"$225,000",36 months
Young Nation,http://youngnation.us/,General operating support.,2016,Closed,"$150,000",36 months
Asian Arts Initiative,http://www.asianartsinitiative.org,General operating support.,2015,Closed,"$225,000",36 months
Center for Cultural Innovation,http://www.cciarts.org,"To support field engagement, documentation, and dissemination activities related to Expanding Investments in Creatives, a 12-month study of the creative ecosystem of contemporary support systems for American artists.",2015,Closed,"$100,000",21 months
Democracy at Work Institute,http://institute.usworker.coop,"To support the Democracy at Work Institute to build critical groundwork for Workers to Owners, a national collaborative to spur more businesses converting to worker cooperatives, with significant potential to increase job quality for low-wage workers of color.",2015,Closed,"$30,000",12 months
Farm Fresh Rhode Island,http://www.farmfreshri.org,To support Farm Fresh in developing its capacity and infrastructure to get locally grown products into large-scale kitchens in Rhode Island and Massachusetts.,2015,Closed,"$150,000",24 months
Fourth Sector Network,www.fourthsector.net,"To support the Fourth Sector Network’s (FSN)—an expanding network of organization working to advance “for-benefit” enterprise—effort in designing and launching an Institute to meet the demand for more convenings, policy analysis, and project support.",2015,Closed,"$47,000",12 months
Greater Baltimore Cultural Alliance,http://baltimoreculture.org,"To support the incubation of the Urban Arts Leadership Program, an initiative to increase the diversity of the regional cultural workforce by offering aspiring administrators of color a pipeline for professional development, networking opportunities, and paid fellowship placements.",2015,Closed,"$50,000",12 months
Hester Street Collaborative,http://hesterstreet.org,General operating support.,2015,Closed,"$375,000",36 months
Local Initiatives Support Corporation New York City,http://www.lisc.org,"To support efforts to develop, synthesize, publish, and disseminate knowledge about arts-based community-development strategies and results in low-income communities, drawing on the experience of the organization’s Creative Placemaking Initiative.",2015,Closed,"$190,000",24 months
Lower Manhattan Cultural Council,http://www.lmcc.net,"To support activities to document, evaluate, and share the Arts East River Waterfront initiative with artists, partners, and other key stakeholders involved in building equitable and vibrant communities.",2015,Closed,"$90,000",12 months
Metropolitan Organizing Strategy Enabling Strength,www.mosesmi.org	,To assess existing pro-transit groups across the country and develop a comprehensive report to define strategies for national groups to collaborate efforts to drive transportation reform.,2015,Closed,"$35,000",12 months
"National League of Cities Institute, Inc",http://www.nlc.org/,To support the National League of Cities Institute in hosting the Equitable Economic Fellowship along side with PolicyLink and the Urban Land Institute.,2015,Active,"$700,000",24 months
National Organization of Minority Architects Charitable and Education Foundation,www.nomala.org,To support the Design as Protest workshop at the 2015 National Organization of Minority Architects Conference.,2015,Closed,"$20,000",12 months
New Orleans Startup Fund,http://www.powermovesnola.org/; http://www.neworleansstartupfund.org,To support the New Orleans Startup Fund to launch PowerMoves@Miami at Black Tech Week in Miami.,2015,Closed,"$45,000",12 months
New York Foundation,,To support the Neighborhoods First Fund to support community-engaged planning with grants to community-based organizations and resource allies that are working in neighborhoods targeted for rezoning or major development by Housing New York.,2015,Active,"$450,000",36 months
Public Advocates Inc.,http://www.publicadvocates.org/,To support local and regional social justice advocates in California to shape and advance state policies that will align equity outcomes with investment in the built environment and infrastructure developments.,2015,Closed,"$450,000",36 months
Soulsville Foundation,http://www.staxmusicacademy.org / www.soulsvillefoundation.org,"To support the SNAP! Afterschool Senior Academy Program, serving middle- and high-school students, ages 13-18.",2015,Closed,"$50,000",12 months
"Vernon Avenue Project, Inc.",www.reconnectcommunity.org,General operating support.,2015,Closed,"$60,000",12 months
American Sustainable Business Institute,http://www.ASBCouncil.org,To support the American Sustainable Business Council to identify policies that create favorable conditions for businesses to adopt high-road employment practices and partner with BFMW to support higher minimum wages.,2015,Closed,"$350,000",24 months
Anchorage Museum,http://www.anchoragemuseum.org,"To support Polar Lab: View from Up Here, a three-year series of exhibitions and programs that explores the relevancy of the North and examines stereotypes to present a contemporary, complex and authentic view of the region and its people.",2015,Closed,"$150,000",36 months
Black Organizing for Leadership & Dignity,http://www.thepraxisproject.org,To support Black Organizing for Leadership and Dignity to strengthen infrastructure for emerging Black leadership leading transformative community-based organizing for healthy and sustainable communities.,2015,Closed,"$50,000",12 months
Business Alliance for Local Living Economies,http://www.bealocalist.org,To support the Business Alliance for Local Living Economies’ Local Economy Fellowship program to build the capacity and connectivity of those who have effectively organized for economic justice with those focused on business models that decentralize business ownership and build collaborations to solve social and economic issues.,2015,Closed,"$250,000",24 months
Cincinnati USA Regional Chamber Foundation,http://www.cincinnatichamber.com/,To support the Cincinnati USA Regional Chamber’s Minority Business Accelerator to provide capacity growth management services to high potential African American and Hispanic firms in Cincinnati to push towards accelerated growth and the increased employment of those firms.,2015,Closed,"$150,000",12 months
Economic Policy Institute,http://www.epi.org,General operating support.,2015,Active,"$450,000",36 months
Funders' Network for Smart Growth and Livable Communities,http://www.fundersnetwork.org,"To engage funders in opportunities to create more sustainable and prosperous regions and communities by supporting funder working groups: Federal Reserve-Philanthropy Initiative, GREEN; Stormwater Funders’ Group; Restoring Prosperity in Older Industrial Cities; and the PLACES fellowship program.",2015,Closed,"$150,000",12 months
Grantmakers in the Arts,http://www.giarts.org,To support the racial equity program track for the 2015 annual Grantmakers in the Arts conference.,2015,Closed,"$10,000",12 months
Groundswell Community Mural Project,www.groundswell.nyc,To support the capstone Portfolio Development art-making program for young people interested in creating portfolios of their artwork for college and scholarship applications.,2015,Closed,"$100,000",24 months
Inner City Advisors,www.icafundgoodjobs.org ,General operating support.,2015,Closed,"$150,000",12 months
"Massachusetts Museum of Contemporary Art Foundation, Inc.",massmoca.org/assetsforartists.org,To support the testing and development of the Assets for Artists toolkit as a strategy for creative place-making.,2015,Closed,"$150,000",36 months
National Domestic Workers Alliance,http://www.domesticworkers.org,"To support the National Domestic Workers Alliance (NDWA) in improving job quality in the domestic work and care industry, through the development of a career lattice framework and credentialing platform, raising standards in the fast-growing online domestic work and care marketplace, and developing its own technology tools to influence the market.",2015,Active,"$675,000",36 months
PolicyLink,http://www.policylink.org,General operating support.,2015,Active,"$600,000",36 months
Rebuild Foundation,http://rebuild-foundation.squarespace.com/,"To support the production of the Black Artists Retreat and the Public Programs of the Dorchester Art+Housing Collaborative, two ongoing programs that engage Chicago’s South Side community and beyond.",2015,Active,"$225,000",36 months
Sundance Institute,http://www.sundance.org,"To support the Native American and Indigenous Film Program, which supports most innovative and exciting Native and Indigenous film storytellers working today, including emerging and established filmmakers creating feature films, short films, episodic content, and multimedia works.",2015,Closed,"$300,000",36 months
"Sustainable Business Education Initiative, Inc.",http://www.sbnphiladelphia.org,To support the Sustainable Business Network’s ongoing efforts to bolster the local economy in the Philadelphia region with a Green Stormwater Industry focus.,2015,Closed,"$300,000",24 months
The Albert Jr. and Tina Small Center for Collaborative Design at Tulane School of Architecture,http://www.tulanecitycenter.org,"To support the development and refinement of the Explore stream of work, in which the organization will work with community partners to research an issue affecting New Orleans or one of its neighborhoods and to create a set of visual materials that articulate the issue and propose a set of equitable solutions.",2015,Closed,"$120,000",12 months
United States Artists,http://unitedstatesartists.org,"To support the 2016 and 2017 Artists Assembly, which provides opportunities for artists to engage with national and local arts leaders and fellow artists in discussions addressing professional issues, new ideas, and collaborations.",2015,Closed,"$60,000",24 months
University of New Mexico School of Architecture and Planning,http://saap.unm.edu/,To provide operating support for the Indigenous Design and Planning Institute.,2015,Closed,"$100,000",24 months
ALIGN: the Alliance for a Greater New York,http://www.alignny.org,"To support the adoption of Jobs to Move America transportation procurement and quality jobs initiative in New York, Chicago and Illinois and build capacity for the local campaign.",2015,Closed,"$150,000",12 months
American Council for an Energy-Efficient Economy,http://www.aceee.org,To expand the role of local and state-level engagement on energy issues in long-term planning for emissions reductions opportunities and utilities of the future.,2015,Closed,"$200,000",24 months
Arizona State University Foundation,http://www.asufoundation.org,"To support NOGALES, a new play by Richard Montoya and Sean San Jose, with Visual and Community Engagement Design by Joan Osato. The artists are creating an immersive platform for a play that includes a state-wide community engagement project, film, media, and site-specific installation and interventions in Arizona.",2015,Closed,"$107,000",24 months
"Arts, Culture and Social Justice Network",www.alternateroots.org,"To support the Arts, Culture and Social Justice Network, which will create a national collaborative network of art leadership and will investigate and build on the practice of art and social change.",2015,Closed,"$30,000",12 months
"Artspace, Inc",http://www.artspacenh.org,"To support The Jerome Project. Created by Titus Kaphar, this project highlights the urgent need for the reform of our criminal justice system. Kaphar will engage with currently and previously incarcerated individuals–all named Jerome–to create a series of paintings, sculptures, experimental documentary, and community convenings.",2015,Closed,"$82,000",12 months
Brightline Defense Project,http://brightlinedefense.org,To support Brightline Defense Project’s continued transition into a larger scale organization that will further its policy work in creating strong local economies.,2015,Closed,"$45,000",12 months
Brooklyn Arts Exchange Inc.,http://www.bax.org,"To support three interconnected initiatives that expand Dancing While Black’s engagement platforms beyond New York City’s Black experimental dance world in order to build community, develop agency, and shift existing artistic and cultural landscapes.",2015,Closed,"$82,000",21 months
Center for Popular Democracy,http://www.populardemocracy.org,To support the Center for Popular Democracy to enable the Fed Up campaign by increasing the campaign’s visibility in local and national media.,2015,Closed,"$48,000",12 months
"Common Market Philadelphia, Inc.",thecommonmarket.org,General operating support.,2015,Closed,"$450,000",36 months
Community Catalyst,http://www.communitycatalyst.org/,To support Community Catalyst’s work engaging local community advocates and the Montefiore medical systems to explore the creation of community benefit activities.,2015,Closed,"$45,000",12 months
D-Rev,http://www.d-rev.org,To support the development of a toolkit for design practice that encompasses the life cycle of the product and the refinement of project selection criteria and processes.,2015,Closed,"$75,000",18 months
Detroit Economic Growth Association,http://www.degc.org,"To support the Detroit Economic Growth Association to establish the Detroit African American Business Leadership Council and produce a development equity dashboard to build linkages, encourage collaboration, and launch new enterprises for African Americans in Detroit.",2015,Closed,"$45,000",26 months
East Bay Community Foundation,http://www.ebcf.org,To support the East Bay Community Foundation to develop a planning process for a regional initiative intended to strengthen collaboration across sectors and advance more equitable and sustainable economic development policies and outcomes.,2015,Closed,"$100,000",12 months
Economic Policy Institute,http://www.epi.org,To support the Economic Policy Institute’s 2015 Annual EARN Conference.,2015,Closed,"$10,000",12 months
"Emerald Cities Collaborative, Inc.",http://www.emeraldcities.org,General operating support.,2015,Closed,"$75,000",12 months
"Emerald Cities Collaborative, Inc.",http://www.emeraldcities.org,General operating support.,2015,Closed,"$600,000",24 months
Environmental and Energy Study Institute,http://www.eesi.org,To support communities across the U.S. move forward with more efficient and equitable energy systems by engaging with the federal government and key state and local stakeholders.,2015,Closed,"$125,000",12 months
Fair Food,http://www.fairfoodphilly.org,To expand the reach and impact of Fair Food’s Value Chain Facilitation work and developing a framework for measuring the organization’s ability to better serve the local food community.,2015,Closed,"$100,000",12 months
Fund Good Jobs,http://www.fundgoodjobs.com,General operating support.,2015,Closed,"$100,000",12 months
Gay Lesbian Bisexual Transgender Historical Society (GLBT),http://www.glbthistory.org/,"To support “Conversations with Gay Elders,” series of single-character video documentaries of varying length, focused on older gay men.  In addition to creating a repository of passing history, it will also function as a vehicle for facilitating inter-generational dialogue and understanding.",2015,Closed,"$57,000",12 months
Good Work Network,http://goodworknetwork.org,To support Good Work Network’s efforts to grow the capacity of minority and disadvantaged enterprises by connecting them to the mainstream economy and develop a business training program for performing artists and culture-bearers.,2015,Closed,"$250,000",24 months
Good Work Network,http://goodworknetwork.org,To support 1) the capacity growth of minority and disadvantaged enterprises and connect them to the mainstream economy and 2) the development of a business training program for performing artists and culture-bearers.,2015,Closed,"$80,000",24 months
Greater New Orleans Foundation,http://www.gnof.org,To support Phase Three of the Urban Water Series to implement green infrastructure and stormwater management strategies in New Orleans.,2015,Closed,"$200,000",12 months
Groundwork USA,http://www.groundworkusa.org,To develop a plan to expand community-based stormwater green infrastructure programs in select cities.,2015,Closed,"$45,000",12 months
Innovation Network for Communities,www.in4c.net ,General operating support.,2015,Closed,"$48,000",18 months
ISAIAH,http://www.isaiahmn.org,To build a powerful grassroots base and align critical constituencies to advance sustainable growth and transportation equity in Minnesota.,2015,Closed,"$375,000",36 months
Jilkaat Kwaan Heritage Center,http://jilkaatkwaanheritagecenter.org,"To support the planning, creation, and installation six original artworks for a Cultural Landscape exhibit to express the intimate relationship between the Chilkat Tlingits and their natural environment. This project will foster social change by informing and inspiring viewers and by building a greater understanding of the Chilkat Tlingit worldview that a balanced ecosystem is essential.",2015,Closed,"$107,000",24 months
Juma Ventures,http://www.Juma.org,General operating support.,2015,Closed,"$48,000",12 months
"Junebug Productions, Inc.",www.junebugproductions.org,"To support the Homecoming Project, 2015-2017, which includes three new place-based storytelling performance projects in the Ninth Ward, Treme, and Mid-city.  This project was initiated in 2011 to explore the meaning of home in post-Katrina New Orleans and to use art/culture to activate spaces to create social change.",2015,Closed,"$107,000",24 months
Khmer Arts Academy,http://www.khmerarts.org,"To support an interdisciplinary performance work that casts a history of ritual lovemaking into the dancing bodies of gay men. This project will engage community members in dialogue through public workshops, panel discussions, and live performance.",2015,Active,"$82,000",36 months
Kiva MicroFunds,http://www.kiva.org,"To support the launch of an online platform to empower American artisan entrepreneurs by enabling them to access 0%-interest capital to start or grow their creative enterprises, while developing new brand ambassadors, business advisers, and customers from their lender pool.",2015,Closed,"$255,000",24 months
Kounkuey Design Initiative,http://www.kounkuey.org/,General operating support.,2015,Closed,"$80,000",24 months
Kounkuey Design Initiative,http://www.kounkuey.org/,General operating support.,2015,Closed,"$250,000",24 months
Los Angeles Poverty Department,http://lapovertydept.org,"To support a new exhibition/archive/performing arts center curated by the Los Angeles Poverty Department, utilizing art and historical consciousness to defend a neighborhood facing repeated and immense gentrification pressures.",2015,Closed,"$107,000",24 months
"MAPP International Productions, Inc.",http://www.mappinternational.org,"To support the NYC premiere of Ralph Lemon’s critically acclaimed Scaffold Room, which will run for seven performances and will integrate a new installation and additional performance features.",2015,Closed,"$15,000",6 months
Mardi Gras Indian Hall of Fame,http://www.mardigrasindianhalloffame.org,"To support and advance programs of the Mardi Gras Indian Hall of Fame, including the perpetuation of authentic New Orleans-specific cultural expressions through youth education, funeral rituals, documentation, performances, and professional-development activities for culture-bearers.",2015,Closed,"$20,000",12 months
